<!ELEMENT AutoOglas (Automobil+)>
<!ELEMENT Automobil (Proizvodjac,Model,Godiste,Farba,ZapreminaMotora,Transmisija, Gorivo, Cena, Kontakt)>
<!ELEMENT Proizvodjac (#PCDATA)>
<!ELEMENT Model (#PCDATA)>
<!ELEMENT Godiste (#PCDATA)>
<!ELEMENT Farba (#PCDATA)>
<!ELEMENT ZapreminaMotora (#PCDATA)>
<!ELEMENT Transmisija (#PCDATA)>
<!ELEMENT Gorivo (#PCDATA)>
<!ELEMENT Cena (#PCDATA)>
<!ELEMENT Kontakt (#PCDATA)>
<!ATTLIST Model tip CDATA #IMPLIED>
<!ATTLIST Farba tip (akril|metalik) #REQUIRED>
<!ATTLIST Transmisija tip (manuelni|auto) #REQUIRED>
<!ATTLIST Gorivo tng (da|ne) #IMPLIED>
<!ATTLIST ZapreminaMotora jedinica (ccm|l) "ccm">
<!ATTLIST Cena valuta (din|eur) "eur">
